{"schema_version":"1.0.0","runtime":{"name":"Grok Bot","vendor":"xAI","version":null,"status":"active","verified_at":"2026-08-21"},"compatibility_level":"L3","native_soul":{"supported":false,"filename_or_convention":null,"notes":"Persistent Bot job/profile is the closest identity surface."},"identity":{"supported":true,"type":"agent-profile","path_or_config":"Bot job/profile","scope":["bot"],"precedence":"product-specific","replace_or_append":"compose","load_timing":"persistent bot execution","version_control_friendly":false,"notes":null},"operations":{"supported":true,"surfaces":[],"hierarchical":false,"nested_discovery":false,"precedence_notes":"Job/source configuration carries operational context."},"authority":{"enforceable_controls":true,"permission_model":"Bot approvals/tool controls","sandbox":null,"approval_model":"product-specific approvals","network_controls":null,"filesystem_controls":null,"managed_policy":null},"lifecycle":{"loading_model":"persistent Bot identity/job context","startup":"persistent","per_turn":null,"lazy_loading":"skills/sources as configured","compaction":"product-specific; test","resume":"persistent bot","reinjection":"product-specific","cache_behavior":null},"mapping":{"SOUL":"Bot job/profile","OPERATIONS":"job + sources","SKILLS":"Bot skills","TASK_CONTEXT":"routines/current work","HARD_POLICY":"approvals/tool controls"},"lossy_mappings":[{"layer":"SOUL","reason":"Identity is configured through product profile/job rather than a versioned SOUL file.","mitigation":"Keep canonical SOUL in source control and update Bot profile from it."}],"limitations":["Profile versioning/export depends on product capabilities."],"verification":{"tests_run":[],"known_failures":[],"notes":null},"sources":[{"url":"https://docs.x.ai/","authority":"official-docs","checked_at":"2026-08-21","notes":"Use current Bots documentation if path changes."}]}
