{"schema_version":"1.0.0","runtime":{"name":"OpenClaw","vendor":null,"version":null,"status":"active","verified_at":"2026-08-21"},"compatibility_level":"L4","native_soul":{"supported":true,"filename_or_convention":"workspace SOUL.md","notes":"Native workspace identity concept; exact bootstrap semantics are version-sensitive."},"identity":{"supported":true,"type":"native-soul","path_or_config":"SOUL.md","scope":["workspace-agent"],"precedence":"runtime-specific bootstrap composition","replace_or_append":"compose","load_timing":"bootstrap","version_control_friendly":true,"notes":null},"operations":{"supported":true,"surfaces":[],"hierarchical":null,"nested_discovery":null,"precedence_notes":"Use workspace/project instructions separately."},"authority":{"enforceable_controls":true,"permission_model":"runtime/tool dependent","sandbox":null,"approval_model":"runtime/tool dependent","network_controls":null,"filesystem_controls":null,"managed_policy":null},"lifecycle":{"loading_model":"workspace/bootstrap context","startup":"load identity/context","per_turn":null,"lazy_loading":null,"compaction":"test on target version","resume":"test on target version","reinjection":"test explicitly","cache_behavior":null},"mapping":{"SOUL":"SOUL.md","OPERATIONS":"workspace/AGENTS-like context","SKILLS":"runtime skills","HARD_POLICY":"runtime/tool permissions"},"lossy_mappings":[],"limitations":["Exact prompt assembly can change by version."],"verification":{"tests_run":[],"known_failures":[],"notes":null},"sources":[{"url":"https://github.com/brunopetrovic/SOUL.md-Blueprint/blob/main/docs/RUNTIME-OPENCLAW.md","authority":"other","checked_at":"2026-08-21","notes":"Follow first-party references in adapter."}]}
