{"schema_version":"1.0.0","runtime":{"name":"Hermes Agent","vendor":"Nous Research","version":null,"status":"active","verified_at":"2026-08-21"},"compatibility_level":"L4","native_soul":{"supported":true,"filename_or_convention":"$HERMES_HOME/SOUL.md","notes":"Dedicated durable identity surface."},"identity":{"supported":true,"type":"native-soul","path_or_config":"$HERMES_HOME/SOUL.md","scope":["global-agent"],"precedence":"identity layer; reverify current docs","replace_or_append":"replace","load_timing":"session bootstrap","version_control_friendly":true,"notes":null},"operations":{"supported":true,"surfaces":[],"hierarchical":true,"nested_discovery":true,"precedence_notes":"Project context remains separate from SOUL."},"authority":{"enforceable_controls":true,"permission_model":"runtime/tool dependent","sandbox":null,"approval_model":"runtime/tool dependent","network_controls":null,"filesystem_controls":null,"managed_policy":null},"lifecycle":{"loading_model":"SOUL loads from HERMES_HOME at session bootstrap.","startup":"load identity","per_turn":null,"lazy_loading":null,"compaction":"test","resume":"verify reinjection","reinjection":"runtime dependent","cache_behavior":null},"mapping":{"SOUL":"$HERMES_HOME/SOUL.md","OPERATIONS":"AGENTS.md/project context","SKILLS":"Hermes skills","HARD_POLICY":"runtime/tool permissions"},"lossy_mappings":[],"limitations":["Reverify first-party docs before production."],"verification":{"tests_run":[],"known_failures":[],"notes":null},"sources":[{"url":"https://hermes-agent.nousresearch.com/docs/user-guide/features/personality/","authority":"official-docs","checked_at":"2026-08-21","notes":null}]}
