{"schema_version":"1.0.0","runtime":{"name":"OpenAI Codex","vendor":"OpenAI","version":null,"status":"active","verified_at":"2026-08-21"},"compatibility_level":"L3","native_soul":{"supported":false,"filename_or_convention":null,"notes":"SOUL semantics map to durable developer/orchestration instructions."},"identity":{"supported":true,"type":"developer-instructions","path_or_config":"developer/orchestration instruction layer","scope":["agent"],"precedence":"higher-level than project AGENTS; product behavior is version-sensitive","replace_or_append":"compose","load_timing":"session/task","version_control_friendly":null,"notes":null},"operations":{"supported":true,"surfaces":[],"hierarchical":true,"nested_discovery":true,"precedence_notes":"Hierarchical AGENTS.md provides project instructions."},"authority":{"enforceable_controls":true,"permission_model":"sandbox/approval configuration","sandbox":"supported by product configuration","approval_model":"runtime-specific","network_controls":"runtime-specific","filesystem_controls":"runtime-specific","managed_policy":null},"lifecycle":{"loading_model":"developer instructions plus AGENTS hierarchy","startup":"task bootstrap","per_turn":null,"lazy_loading":null,"compaction":"test","resume":"test","reinjection":"verify","cache_behavior":null},"mapping":{"SOUL":"developer/orchestrator instructions","OPERATIONS":"AGENTS.md","HARD_POLICY":"sandbox/permissions"},"lossy_mappings":[{"layer":"SOUL","reason":"No native SOUL file convention is assumed.","mitigation":"Compile canonical SOUL into durable developer/orchestration instructions."}],"limitations":["Reverify Codex documentation before production."],"verification":{"tests_run":[],"known_failures":[],"notes":null},"sources":[{"url":"https://developers.openai.com/codex/","authority":"official-docs","checked_at":"2026-08-21","notes":null}]}
