{"schema_version":"1.0.0","runtime":{"name":"Claude Code","vendor":"Anthropic","version":null,"status":"active","verified_at":"2026-08-21"},"compatibility_level":"L3","native_soul":{"supported":false,"filename_or_convention":null,"notes":"No native SOUL filename assumed."},"identity":{"supported":true,"type":"developer-instructions","path_or_config":"persistent/system-level instructions or imported identity file","scope":["user","project","agent"],"precedence":"runtime-specific","replace_or_append":"compose","load_timing":"session/bootstrap","version_control_friendly":true,"notes":null},"operations":{"supported":true,"surfaces":[],"hierarchical":true,"nested_discovery":true,"precedence_notes":"CLAUDE.md carries project/user instructions; skills carry procedures."},"authority":{"enforceable_controls":true,"permission_model":"Claude Code permissions","sandbox":null,"approval_model":"runtime permission prompts","network_controls":null,"filesystem_controls":null,"managed_policy":null},"lifecycle":{"loading_model":"persistent instructions plus CLAUDE/project context","startup":"load instructions","per_turn":null,"lazy_loading":"skills may load on demand","compaction":"test","resume":"test","reinjection":"verify","cache_behavior":null},"mapping":{"SOUL":"durable imported/system identity instructions","OPERATIONS":"CLAUDE.md","SKILLS":"native skills","HARD_POLICY":"permissions"},"lossy_mappings":[{"layer":"SOUL","reason":"No first-class SOUL artifact is assumed.","mitigation":"Keep canonical SOUL and compile/import it."}],"limitations":["Instruction hierarchy is version-sensitive."],"verification":{"tests_run":[],"known_failures":[],"notes":null},"sources":[{"url":"https://docs.anthropic.com/en/docs/claude-code","authority":"official-docs","checked_at":"2026-08-21","notes":null}]}
