{"schema_version":"1.0.0","runtime":{"name":"Pi","vendor":null,"version":null,"status":"active","verified_at":"2026-08-21"},"compatibility_level":"L3","native_soul":{"supported":false,"filename_or_convention":null,"notes":"No native SOUL filename assumed."},"identity":{"supported":true,"type":"system-append","path_or_config":"APPEND_SYSTEM.md","scope":["agent"],"precedence":"system-layer composition","replace_or_append":"append","load_timing":"startup","version_control_friendly":true,"notes":"Preserve useful built-in system behavior."},"operations":{"supported":true,"surfaces":[],"hierarchical":true,"nested_discovery":null,"precedence_notes":"AGENTS.md carries project operations."},"authority":{"enforceable_controls":true,"permission_model":"runtime/tool dependent","sandbox":null,"approval_model":null,"network_controls":null,"filesystem_controls":null,"managed_policy":null},"lifecycle":{"loading_model":"system append plus AGENTS context","startup":"load configured context","per_turn":null,"lazy_loading":null,"compaction":"test","resume":"test","reinjection":"verify","cache_behavior":null},"mapping":{"SOUL":"APPEND_SYSTEM.md","OPERATIONS":"AGENTS.md","SKILLS":"skills","HARD_POLICY":"runtime permissions"},"lossy_mappings":[{"layer":"SOUL","reason":"No dedicated native SOUL semantic type is assumed.","mitigation":"Keep canonical SOUL upstream and compile to APPEND_SYSTEM.md."}],"limitations":["Reverify current Pi documentation before deployment."],"verification":{"tests_run":[],"known_failures":[],"notes":null},"sources":[{"url":"https://github.com/brunopetrovic/SOUL.md-Blueprint/blob/main/docs/runtimes/PI.md","authority":"other","checked_at":"2026-08-21","notes":"Follow first-party references in adapter."}]}
