{"schema_version":"1.0.0","runtime":{"name":"OpenCode","vendor":null,"version":null,"status":"active","verified_at":"2026-08-21"},"compatibility_level":"L3","native_soul":{"supported":false,"filename_or_convention":null,"notes":"Use a custom-agent prompt for identity."},"identity":{"supported":true,"type":"custom-agent","path_or_config":"custom agent prompt/config","scope":["agent"],"precedence":"custom-agent configuration","replace_or_append":"compose","load_timing":"agent invocation","version_control_friendly":true,"notes":null},"operations":{"supported":true,"surfaces":[],"hierarchical":true,"nested_discovery":null,"precedence_notes":"AGENTS.md is operational context."},"authority":{"enforceable_controls":true,"permission_model":"OpenCode permissions/config","sandbox":null,"approval_model":"runtime-specific","network_controls":null,"filesystem_controls":null,"managed_policy":null},"lifecycle":{"loading_model":"custom agent plus project instructions","startup":"agent configuration","per_turn":null,"lazy_loading":null,"compaction":"test","resume":"test","reinjection":"verify","cache_behavior":null},"mapping":{"SOUL":"custom-agent prompt","OPERATIONS":"AGENTS.md","SKILLS":"skills","HARD_POLICY":"permissions"},"lossy_mappings":[{"layer":"SOUL","reason":"Identity is represented through a custom-agent prompt rather than native SOUL.","mitigation":"Generate prompt from canonical SOUL."}],"limitations":["Reverify current OpenCode docs before deployment."],"verification":{"tests_run":[],"known_failures":[],"notes":null},"sources":[{"url":"https://opencode.ai/docs/agents/","authority":"official-docs","checked_at":"2026-08-21","notes":null}]}
