{"schema_version":"1.0.0","runtime":{"name":"DeepSeek Harness","vendor":"DeepSeek","version":null,"status":"developer-preview","verified_at":"2026-08-21"},"compatibility_level":"L3","native_soul":{"supported":false,"filename_or_convention":null,"notes":"Identity maps to system-prompt/preset/plugin layer."},"identity":{"supported":true,"type":"system-replace","path_or_config":"system prompt / preset / identity plugin","scope":["agent"],"precedence":"runtime-specific","replace_or_append":"unknown","load_timing":"bootstrap","version_control_friendly":true,"notes":"Preview behavior may change."},"operations":{"supported":true,"surfaces":[],"hierarchical":true,"nested_discovery":true,"precedence_notes":"AGENTS-compatible workspace context."},"authority":{"enforceable_controls":true,"permission_model":"runtime/plugin dependent","sandbox":null,"approval_model":null,"network_controls":null,"filesystem_controls":null,"managed_policy":null},"lifecycle":{"loading_model":"system identity plus workspace context","startup":"bootstrap","per_turn":null,"lazy_loading":null,"compaction":"preview; test","resume":"preview; test","reinjection":"verify","cache_behavior":null},"mapping":{"SOUL":"system prompt/preset/plugin","OPERATIONS":"AGENTS hierarchy","SKILLS":"plugins/skills","HARD_POLICY":"runtime controls"},"lossy_mappings":[{"layer":"SOUL","reason":"No native SOUL filename is assumed.","mitigation":"Compile into selected identity plugin/preset."}],"limitations":["Developer-preview runtime; breaking changes are plausible."],"verification":{"tests_run":[],"known_failures":[],"notes":null},"sources":[{"url":"https://github.com/brunopetrovic/SOUL.md-Blueprint/blob/main/docs/runtimes/DEEPSEEK-HARNESS.md","authority":"other","checked_at":"2026-08-21","notes":"Follow first-party references in adapter."}]}
